{
  "schema_version":"1.2","event_id":"ed207cf8-6acc-5636-95e7-05e06ac3e391","event_type":"interview.session.completed","occurred_at":"2026-07-23T08:25:00Z",
  "tenant_id":"aaaaaaaa-aaaa-4aaa-8aaa-aaaaaaaaaaaa","aggregate_id":"22222222-2222-4222-8222-222222222222","session_id":"22222222-2222-4222-8222-222222222222","call_attempt_id":"55555555-5555-4555-8555-555555555555",
  "completion_reason":"FINISHED","expected_turn_count":18,"connected_seconds":900,"partial":false,"score_policy_version":"equal-core-questions-v1","overall_score":80.00,
  "english_dimensions":{"comprehension":3,"fluency":3,"vocabulary":3,"grammar":3,"pronunciation":3},"english_band":"WORKING_PROFICIENCY",
  "section_results":[{"section_id":"77777777-7777-4777-8777-777777777777","kind":"CORE","status":"COMPLETED"},{"section_id":"88888888-8888-4888-8888-888888888888","kind":"ENGLISH_SCREEN","status":"COMPLETED"}],
  "question_results":[
    {"section_id":"77777777-7777-4777-8777-777777777777","question_id":"99999999-9999-4999-8999-999999999999","section_kind":"CORE","status":"COMPLETED","score":4,"evaluations":[{"candidate_turn_id":"c307452e-96d1-5745-bbf5-f926e9edffe7","accepted":true,"rubric_score":4,"english_dimensions":null}]},
    {"section_id":"88888888-8888-4888-8888-888888888888","question_id":"aaaaaaaa-1111-4111-8111-111111111111","section_kind":"ENGLISH_SCREEN","status":"COMPLETED","score":3,"evaluations":[{"candidate_turn_id":"ca7a9b3d-fb0d-5e9c-9ed9-ab6c7a3c7735","accepted":true,"rubric_score":3,"english_dimensions":{"comprehension":3,"fluency":3,"vocabulary":3,"grammar":3,"pronunciation":3}}]}
  ]
}
